{
  "$schema": "https://json-schema.org/draft/2020-12/schema",
  "$id": "https://nexus-lab-test-bed.local/contracts/domain/sales-order-line.schema.json",
  "title": "sales-order-line",
  "type": "array",
  "items": {
    "type": "object",
    "additionalProperties": false,
    "properties": {
      "so_code": {
        "$ref": "https://nexus-lab-test-bed.local/contracts/domain/domain-common.schema.json#/$defs/code"
      },
      "line_number": {
        "type": "integer",
        "minimum": 1
      },
      "product_sku": {
        "type": "string",
        "pattern": "^[A-Z0-9][A-Z0-9-]*$"
      },
      "quantity_ordered": {
        "$ref": "https://nexus-lab-test-bed.local/contracts/domain/domain-common.schema.json#/$defs/quantity"
      },
      "quantity_allocated": {
        "$ref": "https://nexus-lab-test-bed.local/contracts/domain/domain-common.schema.json#/$defs/quantity"
      },
      "unit_price": {
        "$ref": "https://nexus-lab-test-bed.local/contracts/domain/domain-common.schema.json#/$defs/money"
      }
    },
    "required": [
      "so_code",
      "line_number",
      "product_sku",
      "quantity_ordered",
      "quantity_allocated",
      "unit_price"
    ]
  }
}
